ResponseId,consent,Gender,Gender_3_TEXT,Age,Condition.RSP.desc,Cond_RSP_happy,Cond_RSP_proud,Cond_RSP_annoyed,Cond_RSP_jealous,Cond_RSP_upset,Cond_RSP_angry,Cond_RSP_inferior,Condition.SP.desc,Cond_SP_happy,Cond_SP_proud,Cond_SP_annoyed,Cond_SP_jealous,Cond_SP_upset,Cond_SP_angry,Cond_SP_inferior
Response ID,Do you consent?,Please Specify your gender: - Selected Choice,Please Specify your gender: - other: please specify - Text,What is your age?,Can you describe a situation in which someone has bragged to you about something? please be as detailed as possible,I was happy for that person,I was proud of that person,I was annoyed by that person,I was jealous that person,I was upset by that person,I was angry at that person,I felt inferior to that person,Can you describe a situation in which you have bragged to someone else about something? please be as detailed as possible,That person was happy for me,That person was proud of me,That person was annoyed by me,That person was jealous of me,That person was upset by me,That person was angry at me,That person felt inferior to me
"{""ImportId"":""_recordId""}","{""ImportId"":""QID1""}","{""ImportId"":""QID32""}","{""ImportId"":""QID32_3_TEXT""}","{""ImportId"":""QID33_TEXT""}","{""ImportId"":""QID19_TEXT""}","{""ImportId"":""QID22""}","{""ImportId"":""QID23""}","{""ImportId"":""QID24""}","{""ImportId"":""QID25""}","{""ImportId"":""QID27""}","{""ImportId"":""QID28""}","{""ImportId"":""QID29""}","{""ImportId"":""QID6_TEXT""}","{""ImportId"":""QID8""}","{""ImportId"":""QID10""}","{""ImportId"":""QID11""}","{""ImportId"":""QID12""}","{""ImportId"":""QID13""}","{""ImportId"":""QID14""}","{""ImportId"":""QID15""}"
1,1,1,,28,"A friend talked about projects he was involved in at work, focusing on the names of the clients as a selling point",5,3,5,1,1,1,1,,,,,,,,
2,1,2,,25,,,,,,,,,modestly (but also bragging?) telling someone that I'm a grad student at stanford ... ,5,5,3,1,3,1,3
3,1,2,,26,"I was at happy hour with a bunch of friends, and they were discussing the best credit cards, which all seemed high level. As a graduate student, I don't think I even make enough to qualify for such a card.",2,3,6,5,1,1,4,,,,,,,,
4,1,2,,29,,,,,,,,,"Sometimes after I've done something very fun and different I brag afterward (e.g., highlighting how great it was). ",4,4,2,2,1,1,1